dassco:taxonID	dassco:name	dassco:author	dassco:fullname	dassco:epithet	dassco:rankid	dassco:extinct	dwc:taxonID	dwc:scientificName	dwc:scientificNameAuthorship	dwc:parentNameUsageID	dwc:parentNameUsage	dwc:acceptedNameUsageID	dwc:acceptedNameUsage	dwc:taxonomicStatus	dwc:taxonRank	sp:taxonID	sp:fullname	sp:author	sp:rankid	sp:rankname	sp:parentname	sp:taxonnr	sp:taxonnrsource
ac93b6056f49b8c420c60152acf1ce4a	Astragalus angustidens var. retusefoliolatus Sirj. & Rech. f.	Širj. & Rech.f.	Astragalus angustidens var. retusefoliolatus Sirj. & Rech. f. Širj. & Rech.f.		240	false										6177278	Astragalus angustidens var. retusefoliolatus Sirj. & Rech.f.		240	variety	Astragalus angustidens		
e8cbe2c00d81fdc247fd6ffbeb81eeda	Astragalus brachycentrus var. koieanus	Sirj. & Bornm.	Astragalus brachycentrus var. koieanus Sirj. & Bornm.		240	false										6177361	Astragalus brachycentrus var. koieanus Sirj. & Bornm.		240	variety	Astragalus brachycentrus		
4b9450cbf09b6b16a8920ce2b32e7212	Astragalus capito var. sikaramensis	Sirj. & Rech. f.	Astragalus capito var. sikaramensis Sirj. & Rech. f.		240	false										6177342	Astragalus capito var. sikaramensis Sirj. & Rech.f.		240	variety	Astragalus capito		
2ebc535e8082b87c9fb1b170f8a6add3	Astragalus dscheratuensis var. viridis Sirj. & Rech. f.	Širj. & Rech.f.	Astragalus dscheratuensis var. viridis Sirj. & Rech. f. Širj. & Rech.f.		240	false										6177335	Astragalus dscheratuensis var. viridis Sirj. & Rech.f.		240	variety	Astragalus dscheratuensis		
e43358b52b710d99579ae722141e1815	Astragalus genistoides var. glabriusculus	illegible	Astragalus genistoides var. glabriusculus illegible		240	false										6177285	Astragalus genistoides var. glabriusculus illegible		240	variety	Astragalus genistoides		
ee99edf07cc9514cd28e6067026627d7	Astragalus ghaznianus var. villosus	Not on Sheet	Astragalus ghaznianus var. villosus Not on Sheet		240	false										6177329	Astragalus ghaznianus var. villosus		240	variety	Astragalus ghaznianus		
3375099fb6b36dbc1e32175c79486163	Astragalus jagnobicus var. shtivensis	Sirj. & Rech. f.	Astragalus jagnobicus var. shtivensis Sirj. & Rech. f.		240	false										6177338	Astragalus jagnobicus var. shtivensis Sirj. & Rech.f.		240	variety	Astragalus jagnobicus		
c78fcd2b6849c58f02f2c2909a0567c6	Astragalus macropterus var. australis	DC.	Astragalus macropterus var. australis DC.		240	false										6121801	Astragalus macropterus var. australis DC.		240	variety	Astragalus macropterus		
20e35dfcd076aecde056c8d0e76fdf0e	Astragalus macrotropis var. robustus	Not on sheet	Astragalus macrotropis var. robustus Not on sheet		240	false										6177310	Astragalus macrotropis var. robustus		240	variety	Astragalus macrotropis		
ca4106c81fc21b7b8c8aa0ffbfec9784	Astragalus nicolai var. carinipilosus	Golosk.	Astragalus nicolai var. carinipilosus Golosk.		240	false										6177317	Astragalus nicolai var. carinipilosus Golosk.		240	variety	Astragalus nicolai		
7344ea4d591de383c3ae6b54fb5c9b15	Astragalus oligophyllus var. nigrocalycinus Sirj. & Rech. f.	Širj. & Rech.f.	Astragalus oligophyllus var. nigrocalycinus Sirj. & Rech. f. Širj. & Rech.f.		240	false										6121815	Astragalus oligophyllus var. nigrocalycinus Sirj. & Rech.f.		240	variety	Astragalus oligophyllus		
a8779f5544551cb37bc7a3ada36f04bb	Astragalus severtzovii var. orbiculatus	Popov	Astragalus severtzovii var. orbiculatus Popov		240	false										6177261	Astragalus severtzovii var. orbiculatus Popov		240	variety	Astragalus severtzovii		
d8f29eda31ffcf00d38dee45814afe5a	Astragalus tienschanicus var. pamiricus	B. Fedtsch.	Astragalus tienschanicus var. pamiricus B. Fedtsch.		240	false										6177275	Astragalus tienschanicus var. pamiricus B. Fedtsch.		240	variety	Astragalus tienschanicus		
e870d894ca3f6af775f0e6afaf9658ef	Astragalus zingeri var. violascens	Popov	Astragalus zingeri var. violascens Popov		240	false										6121879	Astragalus zingeri var. violascens Popov		240	variety	Astragalus zingeri		
ed23bc7996e735cd90d35a20eed149f0	Athyrium alpestre var. americanum		Athyrium alpestre var. americanum 		240	false										367520	Athyrium alpestre var. americanum		240	variety	Athyrium alpestre		
1284357c403d90f1b1c9d8e9904a6715	Athyrium alpestre var. typicum		Athyrium alpestre var. typicum 		240	false										4088344	Athyrium alpestre var. typicum		240	variety	Athyrium alpestre		
9c3694d4a3a478b48f2aa8df03b13728	Atriplex glabriusculum var. pendunculata		Atriplex glabriusculum var. pendunculata 		240	false										4076051	Atriplex glabriusculum var. pendunculata		240	variety	Atriplex glabriusculum		
c79fe82d7f5faac8e1f5a84c8070c6cc	Atropis convoluta var. subscariosa	Hack.	Atropis convoluta var. subscariosa Hack.		240	false										6180163	Atropis convoluta var. subscariosa Hack.		240	variety	Atropis convoluta		
9ae2496a4d2aa7ddadbc99dcf77bb5b6	Baccharis halimimorpha var. myriocephala	(Baker) Baker	Baccharis halimimorpha var. myriocephala (Baker) Baker		240	false										6174813	Baccharis halimimorpha var. myriocephala (Baker) Baker		240	variety	Baccharis halimimorpha		
a006780c43d00ab45eec273c6c1c5b79	Bactris major var. major	Jack.	Bactris major var. major Jack.		240	false										6183427	Bactris major var. major Jack.		240	variety	Bactris major		
5bc1499c284c595c8e9236a6f55da6f3	Bactris major var. major	Jacq.	Bactris major var. major Jacq.		240	false										6129867	Bactris major var. major Jacq.		240	variety	Bactris major		
20b8fa9acecf6726e89a172c953586a7	Balanophora involucrata var. flava	Hook. f.	Balanophora involucrata var. flava Hook. f.		240	false										6182392	Balanophora involucrata var. flava Hook.f.		240	variety	Balanophora involucrata		
d94d1797156d5ef18403a27684f83a66	Banisteria comans var. latifolia A. Juss.	A.Juss.	Banisteria comans var. latifolia A. Juss. A.Juss.		240	false										6178592	Banisteria comans var. latifolia A. Juss.		240	variety	Banisteria comans		
1a8f2f6d04f5c3ca7044629eb9999025	Banisteriopsis cornifolia var. elliptica	(Nied.) B. Gates	Banisteriopsis cornifolia var. elliptica (Nied.) B. Gates		240	false										6123477	Banisteriopsis cornifolia var. elliptica (Nied.) B. Gates		240	variety	Banisteriopsis cornifolia		
29e415e772b951ae6f1b6e2aa7737d43	Barbarea minor var. anfractuosa	Hartvig & Strid	Barbarea minor var. anfractuosa Hartvig & Strid		240	false										6119945	Barbarea minor var. anfractuosa Hartvig & Strid		240	variety	Barbarea minor		
d65ffa692487bf8c756b0657be298dc8	Bartsia alpina var. jensenii		Bartsia alpina var. jensenii 		240	false										4051757	Bartsia alpina var. jensenii		240	variety	Bartsia alpina		
501d7c418dbbd7f206837ac889107c94	Bartsia alpina var. rosea	Böcher	Bartsia alpina var. rosea Böcher		240	false										6118140	Bartsia alpina var. rosea Böcher		240	variety	Bartsia alpina		
5faa14745038dc87b9493550483a7ea2	Basanacantha spinosa var. ferox	(?) Standl.	Basanacantha spinosa var. ferox (?) Standl.		240	false										6182803	Basanacantha spinosa var. ferox (?) Standl.		240	variety	Basanacantha spinosa		
1ab6cfd8f5158d602ad4b8132be7cae3	Basanacantha spinosa var. ferox	(Jacq.) K. Schum.	Basanacantha spinosa var. ferox (Jacq.) K. Schum.		240	false										6182804	Basanacantha spinosa var. ferox (Jacq.) K.Schum.		240	variety	Basanacantha spinosa		
5af54fe9a21511705b45180793a6bf12	Bastardiopsis densiflora var. paraguariensis Hassl.	(Hassl.) Hassl.	Bastardiopsis densiflora var. paraguariensis Hassl. (Hassl.) Hassl.		240	false										6123565	Bastardiopsis densiflora var. paraguariensis Hassl.		240	variety	Bastardiopsis densiflora		
cb89aadb503848fe0e287e0c3c8189ec	Batrachium paucistamineum var. eradicata		Batrachium paucistamineum var. eradicata 		240	false										4051911	Batrachium paucistamineum var. eradicata		240	variety	Batrachium paucistamineum		
ca906059bc23bd488f4d82fed51a032b	Batrachium paucistamineum var. eradicatum		Batrachium paucistamineum var. eradicatum 		240	false										4051913	Batrachium paucistamineum var. eradicatum		240	variety	Batrachium paucistamineum		
d949e7bda2f2b7c5c047e918decedc0f	Batrachium paucistamineum var. erdaricata		Batrachium paucistamineum var. erdaricata 		240	false										4076156	Batrachium paucistamineum var. erdaricata		240	variety	Batrachium paucistamineum		
66020c00ae917dcd97ef604fbe2d0ac4	Batrachium paucistamineum* var. eradicata		Batrachium paucistamineum* var. eradicata 		240	false										4076162	Batrachium paucistamineum* var. eradicata		240	variety	Batrachium paucistamineum*		
eb343c38afee147ac0e4683d69c27e76	Bauhinia angulosa var. densiflora	Benth.	Bauhinia angulosa var. densiflora Benth.		240	false										6121884	Bauhinia angulosa var. densiflora Benth.		240	variety	Bauhinia angulosa		
3a97f8b6556bfad96657a1402bc44a34	Bauhinia bassacensis var. backeri	(de Wit) K Larsen & S.S. Larsen	Bauhinia bassacensis var. backeri (de Wit) K Larsen & S.S. Larsen		240	false										6121886	Bauhinia bassacensis var. backeri (de Wit) K Larsen & S.S. Larsen		240	variety	Bauhinia bassacensis		
aa0d8fd3c7f91201408b60abf4e273f7	Bauhinia involucellata var. jaeckelii K. Larsen	K.Larsen	Bauhinia involucellata var. jaeckelii K. Larsen K.Larsen		240	false										6121904	Bauhinia involucellata var. jaeckelii K. Larsen		240	variety	Bauhinia involucellata		
8e877368def3dc242e3e69b63018c33c	Bauhinia kockiana var. burbidgei	(Stapf) de Wit	Bauhinia kockiana var. burbidgei (Stapf) de Wit		240	false										6121907	Bauhinia kockiana var. burbidgei (Stapf) de Wit		240	variety	Bauhinia kockiana		
59b87ab8bc73220ba8dee7129621280f	Bauhinia sanitwongsei var. glauca	Craib	Bauhinia sanitwongsei var. glauca Craib		240	false										6177369	Bauhinia sanitwongsei var. glauca Craib		240	variety	Bauhinia sanitwongsei		
766aba2cd6f886e82bfd13c9db85d9fd	Bauhinia ungulata var. cuiabensis	(Bong.) Vaz	Bauhinia ungulata var. cuiabensis (Bong.) Vaz		240	false										6121888	Bauhinia ungulata var. cuiabensis (Bong.) Vaz		240	variety	Bauhinia ungulata		
88f90471e76493eae4ec92acc805220e	Beckmannia syzigachne var. uniflora		Beckmannia syzigachne var. uniflora 		240	false										366320	Beckmannia syzigachne var. uniflora		240	variety	Beckmannia syzigachne		
ddac84afd054f15f1f4680883f5ca3d9	Bellis annua var. microcephala	Not on sheet	Bellis annua var. microcephala Not on sheet		240	false										6173541	Bellis annua var. microcephala		240	variety	Bellis annua		
4d3528eb72a9718d69132504190701ab	Bellis annua var. microcephala	Bal.	Bellis annua var. microcephala Bal.		240	false										6173577	Bellis annua var. microcephala Bal.		240	variety	Bellis annua		
31e33af59ebdbdb7a74a8dad31ccd605	Berberis aristata var. umbellata	Hook. f. & Thomson	Berberis aristata var. umbellata Hook. f. & Thomson		240	false										6175366	Berberis aristata var. umbellata Hook.f. & Thomson		240	variety	Berberis aristata		
64caa4cda4cef70d7e28169e5b700061	Betula glandulosa var. typica	Michx.	Betula glandulosa var. typica Michx.		240	false										368196	Betula glandulosa var. typica Michx.		240	variety	Betula glandulosa		
bdc915d63e8bea83bf369158906bcc73	Betula nana var. flabellifolia		Betula nana var. flabellifolia 		240	false										4051998	Betula nana var. flabellifolia		240	variety	Betula nana		
ca2e2b1db7108bc10e8c0d6e1335124f	Betula nana var. genuina		Betula nana var. genuina 		240	false										4088308	Betula nana var. genuina		240	variety	Betula nana		
61b08500b90fde4db8e49da8639fda80	Betula nana var. grandifolia		Betula nana var. grandifolia 		240	false										4051999	Betula nana var. grandifolia		240	variety	Betula nana		
a7af169246ec7f33bfbf3981be54c5e1	Betula nana var. relicta Th. Fr. ex Gürke	Th.Fr. ex Gürke	Betula nana var. relicta Th. Fr. ex Gürke Th.Fr. ex Gürke		240	false										6182864	Betula nana var. relicta Th. Fr. ex Gürke		240	variety	Betula nana		
691c06eef0cdc11c188e39d6deb72a78	Betula odorata var. alpestris		Betula odorata var. alpestris 		240	false										4051989	Betula odorata var. alpestris		240	variety	Betula odorata		
d0b512beadb20c4c366b89f068967da5	Betula odorata var. Beckst		Betula odorata var. Beckst 		240	false										432659	Betula odorata var. Beckst		240	variety	Betula odorata		
284255cbd9c9d7d91631b3e5edf141b2	Betula odorata var. friesii	Regel	Betula odorata var. friesii Regel		240	false										6182637	Betula odorata var. friesii Regel		240	variety	Betula odorata		
f1ee245b1a2fc943dca54da02454394b	Betula odorata var. parvifolia	Wimm.	Betula odorata var. parvifolia Wimm.		240	false										6182634	Betula odorata var. parvifolia Wimm.		240	variety	Betula odorata		
f4528db5331624bbf3c247c2004c3857	Betula odorata var. tortuosa		Betula odorata var. tortuosa 		240	false										4051993	Betula odorata var. tortuosa		240	variety	Betula odorata		
bcfb3c7ea7d2dae39a5e0a296dc62a87	Betula odorata var. tortuosa (Ledeb.) Rosenv	(Ledeb.) Rosenv.	Betula odorata var. tortuosa (Ledeb.) Rosenv (Ledeb.) Rosenv.		240	false										6182636	Betula odorata var. tortuosa (Ledeb.) Rosenv		240	variety	Betula odorata		
bbc99ab4ab4c40f80ca18c18e340cf9a	Betula odurata var. tortuosa		Betula odurata var. tortuosa 		240	false										4051996	Betula odurata var. tortuosa		240	variety	Betula odurata		
8083b6118c9ab62ae0e206f1f7bfa8b4	Betula verrucosa var. arbuscula (Fr.) H.J.P. Winkl.	(Fr.) H.J.P.Winkl.	Betula verrucosa var. arbuscula (Fr.) H.J.P. Winkl. (Fr.) H.J.P.Winkl.		240	false										6182639	Betula verrucosa var. arbuscula (Fr.) H.J.P. Winkl.		240	variety	Betula verrucosa		
1f8940860dca35f90f9e23327ed89374	Billbergia distachia var. disticha	Not on Sheet	Billbergia distachia var. disticha Not on Sheet		240	false										6120021	Billbergia distachia var. disticha		240	variety	Billbergia distachia		
3a954e38264eb20d57b0aecc8e5094f3	Billbergia tweedieana var. latisepala L.B. Sm.	L.B.Sm.	Billbergia tweedieana var. latisepala L.B. Sm. L.B.Sm.		240	false										6175696	Billbergia tweedieana var. latisepala L.B. Sm.		240	variety	Billbergia tweedieana		
61a134018d37fd6c1d9e2fc76d5bb58d	Blastus borneensis var. eberhardtii	(Guill.) C. Hansen	Blastus borneensis var. eberhardtii (Guill.) C. Hansen		240	false										6123849	Blastus borneensis var. eberhardtii (Guill.) C. Hansen		240	variety	Blastus borneensis		
ef751988d80f513022ad19e59ddc1314	Blastus borneensis var. pulverulentus	(Ridl.) C. Hansen	Blastus borneensis var. pulverulentus (Ridl.) C. Hansen		240	false										6123850	Blastus borneensis var. pulverulentus (Ridl.) C. Hansen		240	variety	Blastus borneensis		
63e2b1478f33f9519f8d6a4a7cda9c6d	Blechnum spicant var. fallax	Lange	Blechnum spicant var. fallax Lange		240	false										6128607	Blechnum spicant var. fallax Lange		240	variety	Blechnum spicant		
bb6238981a5431d1f38467b3b931c291	Blepharis cuanzensis var. leptophylla	S. Moore	Blepharis cuanzensis var. leptophylla S. Moore		240	false										6114376	Blepharis cuanzensis var. leptophylla S. Moore		240	variety	Blepharis cuanzensis		
c03c28ac103b08b3198fe2e18c6e548a	Boerhavia repens var. diffusa	(L.) Boiss.	Boerhavia repens var. diffusa (L.) Boiss.		240	false										6115876	Boerhavia repens var. diffusa (L.) Boiss.		240	variety	Boerhavia repens		
8f70f0a1325ff800dc6158b63dd70041	Bombax rhodognaphalon var. tomentosum	Robyns	Bombax rhodognaphalon var. tomentosum Robyns		240	false										6114713	Bombax rhodognaphalon var. tomentosum Robyns		240	variety	Bombax rhodognaphalon		
9402e538ddc30bd62e5756cc5fa1317d	Botrychium lunaria var. minganense		Botrychium lunaria var. minganense 		240	false										365393	Botrychium lunaria var. minganense		240	variety	Botrychium lunaria		
fe017b7b780e7d890e2be0cd689b4b02	Bouchea pinnatifida var. racemosa	"""Schinz"""	"Bouchea pinnatifida var. racemosa ""Schinz"""		240	false										6171035	"Bouchea pinnatifida var. racemosa ""Schinz"""		240	variety	Bouchea pinnatifida		
c9a17990b81aafd7486cd8f746d3d03d	Bouchea prismatica var. longirostra	Grenz.	Bouchea prismatica var. longirostra Grenz.		240	false										6127470	Bouchea prismatica var. longirostra Grenz.		240	variety	Bouchea prismatica		
1cc8df21eb6964e8b797c2e944306076	Brachycarpaea varians var. purpurascens	Harv. & Sond.	Brachycarpaea varians var. purpurascens Harv. & Sond.		240	false										6183565	Brachycarpaea varians var. purpurascens Harv. & Sond.		240	variety	Brachycarpaea varians		
d534c3821f693b462530168767b4559b	Braya novae angliae var. interior		Braya novae angliae var. interior 		240	false										4076278	Braya novae angliae var. interior		240	variety	Braya novae angliae		
6d4a628245af0ab83b2c5d4b309b3d0c	Braya novae-angliae var. interior		Braya novae-angliae var. interior 		240	false										367809	Braya novae-angliae var. interior		240	variety	Braya novae-angliae		
b351683462445974c535687fa336d978	Bredemeyera laurifolia var. parvifolia A.W. Benn.	A.W.Benn.	Bredemeyera laurifolia var. parvifolia A.W. Benn. A.W.Benn.		240	false										6180259	Bredemeyera laurifolia var. parvifolia A.W. Benn.		240	variety	Bredemeyera laurifolia		
3f875d674897d7e28acf65dc5aec6fc2	Bremekampia tentaculata var. plumosa (T. Anderson) M.R. Almeida	(T.Anderson) M.R.Almeida	Bremekampia tentaculata var. plumosa (T. Anderson) M.R. Almeida (T.Anderson) M.R.Almeida		240	false										6117306	Bremekampia tentaculata var. plumosa (T.Anderson) M.R. Almeida		240	variety	Bremekampia tentaculata		
78af8332f0ef04002e4b156e0874dad9	Brickellia brasiliensis var. pernambucense	B.L. Rob.	Brickellia brasiliensis var. pernambucense B.L. Rob.		240	false										6118739	Brickellia brasiliensis var. pernambucense B.L. Rob.		240	variety	Brickellia brasiliensis		
ee442feeb0a83954f226f09da2f296a8	Brickellia veronicifolia var. senilis B.L. Rob.	B.L.Rob.	Brickellia veronicifolia var. senilis B.L. Rob. B.L.Rob.		240	false										6118744	Brickellia veronicifolia var. senilis B.L. Rob.		240	variety	Brickellia veronicifolia		
00be8c6688de1f9faeaff23796567f73	Briza media var. pallida	Not on sheet	Briza media var. pallida Not on sheet		240	false										6182538	Briza media var. pallida		240	variety	Briza media		
d94b90994f5ff379e53936fe32d6c06b	Bromus commutatus var. umbrosus	Hack.	Bromus commutatus var. umbrosus Hack.		240	false										6179874	Bromus commutatus var. umbrosus Hack.		240	variety	Bromus commutatus		
2f98d615c00388d5c0db2dd26dffab4a	Bromus mallis var. lejastachys	Not on sheet	Bromus mallis var. lejastachys Not on sheet		240	false										6171251	Bromus mallis var. lejastachys		240	variety	Bromus mallis		
390837ae2e765fe7eee9bfe5303151f6	Bupleurum foliosum var. hispanicum H. Wolff	H.Wolff	Bupleurum foliosum var. hispanicum H. Wolff H.Wolff		240	false										6119621	Bupleurum foliosum var. hispanicum H. Wolff		240	variety	Bupleurum foliosum		
3413969c79b6df0cfc8631ca7661bdaf	Bupleurum gilbraltarium var. coriaceum	L.'Hér.	Bupleurum gilbraltarium var. coriaceum L.'Hér.		240	false										6119623	Bupleurum gilbraltarium var. coriaceum L'Hér.		240	variety	Bupleurum gilbraltarium		
27770d68ed609cb21c3acd129001737f	Bupleurum tenuissimum var. procumbens (Desf.) H. Wolff	(Desf.) H.Wolff	Bupleurum tenuissimum var. procumbens (Desf.) H. Wolff (Desf.) H.Wolff		240	false										6170391	Bupleurum tenuissimum var. procumbens (Desf.) H. Wolff		240	variety	Bupleurum tenuissimum		
fda121973e3352b0cdb70382a454888c	Byrsonima vaccinifolia var. cearensis	Griseb.	Byrsonima vaccinifolia var. cearensis Griseb.		240	false										6183144	Byrsonima vaccinifolia var. cearensis Griseb.		240	variety	Byrsonima vaccinifolia		
6aaf3cce9d25881223fc1d3e9c4a18f1	Byrsonima verbascifolia var. intermedia A. Juss.	A.Juss.	Byrsonima verbascifolia var. intermedia A. Juss. A.Juss.		240	false										6183115	Byrsonima verbascifolia var. intermedia A. Juss.		240	variety	Byrsonima verbascifolia		
e3bdd6b45ec7d0ce257591dfc3a8f39e	Byttneria melastomifolia var. puberula	K. Schum.	Byttneria melastomifolia var. puberula K. Schum.		240	false										6127040	Byttneria melastomifolia var. puberula K.Schum.		240	variety	Byttneria melastomifolia		
5db1b068e940426920bfe7ef5bde5271	Cabralea polytricha var. affinis C. DC.	C.DC.	Cabralea polytricha var. affinis C. DC. C.DC.		240	false										6124160	Cabralea polytricha var. affinis C.DC.		240	variety	Cabralea polytricha		
99b74a2bd2f1f45ae4c10aed433154ec	Calamagrostis arindinacea var. purpurascens		Calamagrostis arindinacea var. purpurascens 		240	false										4051628	Calamagrostis arindinacea var. purpurascens		240	variety	Calamagrostis arindinacea		
5fe23c89029c5cd8c8b7a6330b07df91	Calamagrostis arundinacea var. purpurascens		Calamagrostis arundinacea var. purpurascens 		240	false										366253	Calamagrostis arundinacea var. purpurascens		240	variety	Calamagrostis arundinacea		
30452a8332786d5d6f4f13ae9dddc01d	Calamagrostis canadensis var. arcta		Calamagrostis canadensis var. arcta 		240	false										4097512	Calamagrostis canadensis var. arcta		240	variety	Calamagrostis canadensis		
a500b01cfa554e302c13c00b5b72fd09	Calamagrostis canadensis var. langsdorfii		Calamagrostis canadensis var. langsdorfii 		240	false										366280	Calamagrostis canadensis var. langsdorfii		240	variety	Calamagrostis canadensis		
58cb824a89b4a1ea3316ec3f4278621a	Calamagrostis canadensis var. scabra		Calamagrostis canadensis var. scabra 		240	false										366298	Calamagrostis canadensis var. scabra		240	variety	Calamagrostis canadensis		
9ae8ce403ce98e7f1d692f84574cb20b	Calamagrostis lapponica var. groenlandica		Calamagrostis lapponica var. groenlandica 		240	false										366290	Calamagrostis lapponica var. groenlandica		240	variety	Calamagrostis lapponica		
d42dacadf09f71fb51229ce846b2ce05	Calamagrostis neglecta var. borealis		Calamagrostis neglecta var. borealis 		240	false										366292	Calamagrostis neglecta var. borealis		240	variety	Calamagrostis neglecta		
9f8485cc138d138099cb84498fd2e782	Calamagrostis phragmitoides var. hallerianum	Not on Sheet	Calamagrostis phragmitoides var. hallerianum Not on Sheet		240	false										6182540	Calamagrostis phragmitoides var. hallerianum		240	variety	Calamagrostis phragmitoides		
e9dc0be61d16adcf41c774b813aff391	Calamagrostis pseudophragmites var. condensata	(Lange)	Calamagrostis pseudophragmites var. condensata (Lange)		240	false										366282	Calamagrostis pseudophragmites var. condensata (Lange)		240	variety	Calamagrostis pseudophragmites		
ea0cf1b31626076ef2f2bf10ca4856c7	Calamagrostis pseudophragmites var. laevigata	(Lange)	Calamagrostis pseudophragmites var. laevigata (Lange)		240	false										366287	Calamagrostis pseudophragmites var. laevigata (Lange)		240	variety	Calamagrostis pseudophragmites		
34256248b1a9ea2d6b7bc7acb9775047	Calamagrostis stricta var. borealis		Calamagrostis stricta var. borealis 		240	false										366274	Calamagrostis stricta var. borealis		240	variety	Calamagrostis stricta		
ff7fc6b75f095687f9549f65b41c9d0e	Calamintha menthifolia var. pauciflora	Lange	Calamintha menthifolia var. pauciflora Lange		240	false										6178026	Calamintha menthifolia var. pauciflora Lange		240	variety	Calamintha menthifolia		
847f7c19abf7ea698aff62db781a5e2d	Calamintha officinalis var. adscendens	Jord.	Calamintha officinalis var. adscendens Jord.		240	false										6178028	Calamintha officinalis var. adscendens Jord.		240	variety	Calamintha officinalis		
7c407dd1b4854676f7a22616ad05a39d	Calendula lusitanica var. microcephala	Lange	Calendula lusitanica var. microcephala Lange		240	false										6177934	Calendula lusitanica var. microcephala Lange		240	variety	Calendula lusitanica		
5425a8cc840c27b62a9045df5af09513	Callicarpa giraldii var. subacanescens	Rehder	Callicarpa giraldii var. subacanescens Rehder		240	false										6127476	Callicarpa giraldii var. subacanescens Rehder		240	variety	Callicarpa giraldii		
ecc7178866831c5895f349acb614b6d5	Callisthene major var. pubescens	Not on Sheet	Callisthene major var. pubescens Not on Sheet		240	false										6181534	Callisthene major var. pubescens		240	variety	Callisthene major		
48be9286228aa825c58727bb0de943c6	Callitriche autumnalis var. arctica		Callitriche autumnalis var. arctica 		240	false										4052091	Callitriche autumnalis var. arctica		240	variety	Callitriche autumnalis		
5c489b3edce44ee6b86d357f9f813907	Callitriche verna var. minima		Callitriche verna var. minima 		240	false										4076100	Callitriche verna var. minima		240	variety	Callitriche verna		
7f426a27d5b07a3962143d1342eee583	Calocarpum mammosum var. ovidea	Pierre	Calocarpum mammosum var. ovidea Pierre		240	false										6180855	Calocarpum mammosum var. ovidea Pierre		240	variety	Calocarpum mammosum		
6e33e8103258d07418c8f0828afed3c4	Calophyllum soulattri var. sorsogonense	P.F. Stevens	Calophyllum soulattri var. sorsogonense P.F. Stevens		240	false										6120420	Calophyllum soulattri var. sorsogonense P.F. Stevens		240	variety	Calophyllum soulattri		
491a0f9b451625d38c5dd433dd56f129	Calospermum mammosum var. ovidea	Pierre	Calospermum mammosum var. ovidea Pierre		240	false										6180851	Calospermum mammosum var. ovidea Pierre		240	variety	Calospermum mammosum		
b2cd1666464252a7deea8adcd391b74f	Camchaya loloana var. pseudotenuiflora H. Koyama	H.Koyama	Camchaya loloana var. pseudotenuiflora H. Koyama H.Koyama		240	false										6118761	Camchaya loloana var. pseudotenuiflora H. Koyama		240	variety	Camchaya loloana		
26de23052611bb441a18b3eca0755471	Campanula groenlandica var. uniflora		Campanula groenlandica var. uniflora 		240	false										4052367	Campanula groenlandica var. uniflora		240	variety	Campanula groenlandica		
308c109f6d39883e187c5be6b4bea256	Campanula grónlandica var. minor		Campanula grónlandica var. minor 		240	false										4052392	Campanula grónlandica var. minor		240	variety	Campanula grónlandica		
5b445f7c42a3e21102a25050f2185e19	Campanula rotundifola var. arctica		Campanula rotundifola var. arctica 		240	false										4088652	Campanula rotundifola var. arctica		240	variety	Campanula rotundifola		
