dassco:taxonID	dassco:name	dassco:author	dassco:fullname	dassco:epithet	dassco:rankid	dassco:extinct	dwc:taxonID	dwc:scientificName	dwc:scientificNameAuthorship	dwc:parentNameUsageID	dwc:parentNameUsage	dwc:acceptedNameUsageID	dwc:acceptedNameUsage	dwc:taxonomicStatus	dwc:taxonRank	sp:taxonID	sp:fullname	sp:author	sp:rankid	sp:rankname	sp:parentname	sp:taxonnr	sp:taxonnrsource
432f46a76c86421788e1cf9ba600550b	Ilex phillyreifolia var. leucocalyx	Loes.	Ilex phillyreifolia var. leucocalyx Loes.		240	false										6118118	Ilex phillyreifolia var. leucocalyx Loes.		240	variety	Ilex phillyreifolia		
71c7c5107104a47afaad8e8e4c79c23a	Ilex theezans var. augustii	Loes.	Ilex theezans var. augustii Loes.		240	false										6118251	Ilex theezans var. augustii Loes.		240	variety	Ilex theezans		
0f5e5dfc6295367e258779187a5a6e00	Imperata cylindrica var. africana (Andersson) C.E. Hubb.	(Andersson) C.E.Hubb.	Imperata cylindrica var. africana (Andersson) C.E. Hubb. (Andersson) C.E.Hubb.		240	false										6172799	Imperata cylindrica var. africana (Andersson) C.E. Hubb.		240	variety	Imperata cylindrica		
a413e2a9002c9b577319ba6219dde566	Imperata cylindrica var. thunbergii (Retz.) T. Durand & Schinz	(Retz.) T.Durand & Schinz	Imperata cylindrica var. thunbergii (Retz.) T. Durand & Schinz (Retz.) T.Durand & Schinz		240	false										6172800	Imperata cylindrica var. thunbergii (Retz.) T. Durand & Schinz		240	variety	Imperata cylindrica		
dffe3b91a0ea0d437f3c0142045c320f	Ipomoea cissoides var. subintegrifolia	Meisn.	Ipomoea cissoides var. subintegrifolia Meisn.		240	false										6176163	Ipomoea cissoides var. subintegrifolia Meisn.		240	variety	Ipomoea cissoides		
2d01531f154106e7f4295152ab598970	Ipomoea cynanchifolia var. petiolaris	Not on Sheet	Ipomoea cynanchifolia var. petiolaris Not on Sheet		240	false										6183169	Ipomoea cynanchifolia var. petiolaris		240	variety	Ipomoea cynanchifolia		
869c768f3bf0ce96609af9f87311eab6	Ipomoea pes-caprae var. emarginata	Hallier f.	Ipomoea pes-caprae var. emarginata Hallier f.		240	false										6172531	Ipomoea pes-caprae var. emarginata Hallier f.		240	variety	Ipomoea pes-caprae		
c808272fc9c0030f440607e67ee77b88	Iresine vermicularis var. longespicata	Seub.	Iresine vermicularis var. longespicata Seub.		240	false										6117726	Iresine vermicularis var. longespicata Seub.		240	variety	Iresine vermicularis		
0e43edd810e4d574abed00f694ce8998	Isoetes echinospora var. muricata		Isoetes echinospora var. muricata 		240	false										367592	Isoetes echinospora var. muricata		240	variety	Isoetes echinospora		
964d34eb539a4785c313e37a64551ad6	Jacobinia ovata var. subglabra	S. Watson	Jacobinia ovata var. subglabra S. Watson		240	false										6173533	Jacobinia ovata var. subglabra S. Watson		240	variety	Jacobinia ovata		
8e46a7914cd75560241fee8606b60d59	Jacquinia berterii var. portoricensis	Urb.	Jacquinia berterii var. portoricensis Urb.		240	false										6181213	Jacquinia berterii var. portoricensis Urb.		240	variety	Jacquinia berterii		
e1be491c18ef62f85dce301a3699208b	Jamesonia verticalis var. frigida	Hieron.	Jamesonia verticalis var. frigida Hieron.		240	false										6181830	Jamesonia verticalis var. frigida Hieron.		240	variety	Jamesonia verticalis		
80a943e560b8d7f96c35c02563bf5ccf	Jatropha bornmuelleri var. penicillata Fern. Casas	Fern.Casas	Jatropha bornmuelleri var. penicillata Fern. Casas Fern.Casas		240	false										6121614	Jatropha bornmuelleri var. penicillata Fern. Casas		240	variety	Jatropha bornmuelleri		
ae555f28ab00f425d2266c7b2586a90a	Jatropha curcas var. glabrata	Schumach. & Thonn.	Jatropha curcas var. glabrata Schumach. & Thonn.		240	false										6172832	Jatropha curcas var. glabrata Schumach. & Thonn.		240	variety	Jatropha curcas		
295dc4712d923626742896520bea8951	Jatropha curcas var. rufus	Mc Vaugh	Jatropha curcas var. rufus Mc Vaugh		240	false										6177157	Jatropha curcas var. rufus Mc Vaugh		240	variety	Jatropha curcas		
0cbd1e9217c3c64200c5d19387b595ed	Jatropha oligandra var. pubescens	Taub.	Jatropha oligandra var. pubescens Taub.		240	false										6177154	Jatropha oligandra var. pubescens Taub.		240	variety	Jatropha oligandra		
d61b58c888d120ec0417ad71338a740b	Jatropha spinosa var. genuina	Pax	Jatropha spinosa var. genuina Pax		240	false										6121620	Jatropha spinosa var. genuina Pax		240	variety	Jatropha spinosa		
3835b7bfe1620cbb86d79a0d50cb7bcf	Jatropha vitifolia var. genuina	Chodat & Hassl.	Jatropha vitifolia var. genuina Chodat & Hassl.		240	false										6177150	Jatropha vitifolia var. genuina Chodat & Hassl.		240	variety	Jatropha vitifolia		
36e24fe2d26106ea3d1ebbd8da80af99	Juncus alpinus var. alpestris		Juncus alpinus var. alpestris 		240	false										4088681	Juncus alpinus var. alpestris		240	variety	Juncus alpinus		
71b0aa44adff39d3bb99c60d736285a9	Juncus articulatus var. lindhardtii	Wiinst.	Juncus articulatus var. lindhardtii Wiinst.		240	false										6118193	Juncus articulatus var. lindhardtii Wiinst.		240	variety	Juncus articulatus		
d4f6669df7d517fe3a594ae5078b12d7	Juncus castaneus var. fuscus		Juncus castaneus var. fuscus 		240	false										4088199	Juncus castaneus var. fuscus		240	variety	Juncus castaneus		
eb6383c82b4244af999a1dad9a62fbbc	Juncus triglumis var. copelandi		Juncus triglumis var. copelandi 		240	false										4075990	Juncus triglumis var. copelandi		240	variety	Juncus triglumis		
6ab1da1accf3ec8bc8bdd9fb0cc531ef	Juncus triglumis var. copelandii		Juncus triglumis var. copelandii 		240	false										367376	Juncus triglumis var. copelandii		240	variety	Juncus triglumis		
5b844bde770dc535f073258510739c4e	Juniperus communis var. alpina		Juniperus communis var. alpina 		240	false										365223	Juniperus communis var. alpina		240	variety	Juniperus communis		
29f298dcaec8ecbcdbcbdab832632f7a	Juniperus communis var. montana		Juniperus communis var. montana 		240	false										365218	Juniperus communis var. montana		240	variety	Juniperus communis		
72fedd951bb4a002253a3c81006ec33a	Juniperus communis var. nana		Juniperus communis var. nana 		240	false										365221	Juniperus communis var. nana		240	variety	Juniperus communis		
7cc40cb94d0f80da254de217847bd276	Juniperus communis var. saxatilis		Juniperus communis var. saxatilis 		240	false										4051977	Juniperus communis var. saxatilis		240	variety	Juniperus communis		
c3def066866368c622d77f919c1564c4	Jussiaea repens var. difussa	(Forssk.) Brenan	Jussiaea repens var. difussa (Forssk.) Brenan		240	false										6171708	Jussiaea repens var. difussa (Forssk.) Brenan		240	variety	Jussiaea repens		
c412a6e2e926d9f6d888d5955a715c67	Justicia betonica var. ramosissima	Roxb.	Justicia betonica var. ramosissima Roxb.		240	false										6117395	Justicia betonica var. ramosissima Roxb.		240	variety	Justicia betonica		
14847790de47fd5d689f0481cb35c77a	Justicia imbricata var. caulescens	Nees	Justicia imbricata var. caulescens Nees		240	false										6181437	Justicia imbricata var. caulescens Nees		240	variety	Justicia imbricata		
ead804d0b8433b1530e85b90a20158d9	Justicia lolioides var. latifolia S. Moore	S.Moore	Justicia lolioides var. latifolia S. Moore S.Moore		240	false										6170327	Justicia lolioides var. latifolia S. Moore		240	variety	Justicia lolioides		
4684d3821fe604e8f6d2eaf4c450fbb8	Justicia simplex var. serpyllifolia	Benth. ex C.B. Clarke	Justicia simplex var. serpyllifolia Benth. ex C.B. Clarke		240	false										6117432	Justicia simplex var. serpyllifolia Benth. ex C.B. Clarke		240	variety	Justicia simplex		
ca84394201e0ce26db312fd180cdac81	Kalbfussia salzamanii var. hispanica	Lange	Kalbfussia salzamanii var. hispanica Lange		240	false										6175089	Kalbfussia salzamanii var. hispanica Lange		240	variety	Kalbfussia salzamanii		
d33701ac7874db6cf4eed63960a46faf	Kalmia angustifolia var. angustifolia	Not on sheet	Kalmia angustifolia var. angustifolia Not on sheet		240	false										6121358	Kalmia angustifolia var. angustifolia		240	variety	Kalmia angustifolia		
4883485ee2341a09d53386ab847fc0a3	Kalmia glauca var. intermedia	Lange	Kalmia glauca var. intermedia Lange		240	false										6176995	Kalmia glauca var. intermedia Lange		240	variety	Kalmia glauca		
67a7cdcc60bab24e69d3308bbc910bc8	Knema conferta var. siamensis	Not on Sheet	Knema conferta var. siamensis Not on Sheet		240	false										6179163	Knema conferta var. siamensis		240	variety	Knema conferta		
66c2a59335ef62012630aa84485965a2	Kohautia caespitosa var. schimperi (C. Presl) Bremek.	(C.Presl) Bremek.	Kohautia caespitosa var. schimperi (C. Presl) Bremek. (C.Presl) Bremek.		240	false										6171626	Kohautia caespitosa var. schimperi (C. Presl) Bremek.		240	variety	Kohautia caespitosa		
e4cf2cbdef6bec4a6d81071ec97d3513	Kyllinga odorata var. rigida Boeck.	Boeckeler	Kyllinga odorata var. rigida Boeck. Boeckeler		240	false										6178147	Kyllinga odorata var. rigida Boeck.		240	variety	Kyllinga odorata		
a1b6c7e8e592aa4042556ce56959d683	Lactuca virosa var. maculata	(Hornem.) DC.	Lactuca virosa var. maculata (Hornem.) DC.		240	false										6119161	Lactuca virosa var. maculata (Hornem.) DC.		240	variety	Lactuca virosa		
3a2f5f950dd5d3cae70c16ac8f196ea7	Lagenocarpus rigidus var. arundinaceus	H. Pfeiff.	Lagenocarpus rigidus var. arundinaceus H. Pfeiff.		240	false										6176704	Lagenocarpus rigidus var. arundinaceus H.Pfeiff.		240	variety	Lagenocarpus rigidus		
eaba1626c111c982ce221ee4740f5060	Lagochilus hirtus var. dshungaricus	Golosk.	Lagochilus hirtus var. dshungaricus Golosk.		240	false										6122705	Lagochilus hirtus var. dshungaricus Golosk.		240	variety	Lagochilus hirtus		
bc071c487565be2ce7160c51bb3847dd	Lamium album var. roseum	Lange	Lamium album var. roseum Lange		240	false										6177970	Lamium album var. roseum Lange		240	variety	Lamium album		
8869dc89a7e528f6d750992877f45f40	Lamium garganicum var. striatum	(Sibth. & Sm.) Bald.	Lamium garganicum var. striatum (Sibth. & Sm.) Bald.		240	false										6122714	Lamium garganicum var. striatum (Sibth. & Sm.) Bald.		240	variety	Lamium garganicum		
11ac10e3c1634e3742e734a60ee72efd	Landolphia scandens var. genuina	Hallier f.	Landolphia scandens var. genuina Hallier f.		240	false										6173265	Landolphia scandens var. genuina Hallier f.		240	variety	Landolphia scandens		
7612c891942cdd56b80d781dbeb1f543	Lasianthaea ceanothifolia var. gracilis (W.W. Jones) K.M. Becker	(W.W.Jones) K.M.Becker	Lasianthaea ceanothifolia var. gracilis (W.W. Jones) K.M. Becker (W.W.Jones) K.M.Becker		240	false										6119165	Lasianthaea ceanothifolia var. gracilis (W.W. Jones) K.M. Becker		240	variety	Lasianthaea ceanothifolia		
26b0499e6db86ce8554830eec50f82b4	Lasianthaea ceanothifolia var. gradata (S.F. Blake)  K.M. Becker	(S.F.Blake) K.M.Becker	Lasianthaea ceanothifolia var. gradata (S.F. Blake)  K.M. Becker (S.F.Blake) K.M.Becker		240	false										6119166	Lasianthaea ceanothifolia var. gradata (S.F. Blake)  K.M. Becker		240	variety	Lasianthaea ceanothifolia		
f9897833fb326588e1d114db9b0666c0	Lasianthaea fruticosa var. alamosana K.M. Becker	K.M.Becker	Lasianthaea fruticosa var. alamosana K.M. Becker K.M.Becker		240	false										6119169	Lasianthaea fruticosa var. alamosana K.M. Becker		240	variety	Lasianthaea fruticosa		
2246e386b6c4c5276535f559ab7005a1	Lastraea spinulosa var. gronlandrea		Lastraea spinulosa var. gronlandrea 		240	false										365328	Lastraea spinulosa var. gronlandrea		240	variety	Lastraea spinulosa		
8788eba53bab0731f4e3624f4d03579c	Lastraea spinulosa var. intermdia		Lastraea spinulosa var. intermdia 		240	false										365325	Lastraea spinulosa var. intermdia		240	variety	Lastraea spinulosa		
eeb0932ae554200b887ed121abacbe0a	Lastrea spinulosa var. dilatata		Lastrea spinulosa var. dilatata 		240	false										367601	Lastrea spinulosa var. dilatata		240	variety	Lastrea spinulosa		
1e550c4aeefc0808deae61dce686eb54	Lastrea spinulosa var. intermedia	J. Milde	Lastrea spinulosa var. intermedia J. Milde		240	false										6182590	Lastrea spinulosa var. intermedia J. Milde		240	variety	Lastrea spinulosa		
ce3edd60b0d1a81c97730778875eaaff	Lastrea spinulosa var. intermedia		Lastrea spinulosa var. intermedia 		240	false										367599	Lastrea spinulosa var. intermedia		240	variety	Lastrea spinulosa		
856bbf4306cf66981406294c1e354538	Lastreopsis effusa var. confinis	(C. Chr.) Tindale	Lastreopsis effusa var. confinis (C. Chr.) Tindale		240	false										6181834	Lastreopsis effusa var. confinis (C. Chr.) Tindale		240	variety	Lastreopsis effusa		
808de983b4ae7e0acf51045679e36091	Lastreopsis effusa var. confinis	(C. Chr.) C. Sánchez	Lastreopsis effusa var. confinis (C. Chr.) C. Sánchez		240	false										6128105	Lastreopsis effusa var. confinis (C. Chr.) C. Sánchez		240	variety	Lastreopsis effusa		
5843d74c33d64ad3b4cbb1165e79dea2	Lathyrus japonicus var. alenticus		Lathyrus japonicus var. alenticus 		240	false										365744	Lathyrus japonicus var. alenticus		240	variety	Lathyrus japonicus		
4901432f3009ce046bd359e2bba855a0	Lathyrus maritimus var. alenticus		Lathyrus maritimus var. alenticus 		240	false										365745	Lathyrus maritimus var. alenticus		240	variety	Lathyrus maritimus		
37f1ea6644e2817c0cd66ec4cff4e27f	Ledum palustre var. decumbens		Ledum palustre var. decumbens 		240	false										4052281	Ledum palustre var. decumbens		240	variety	Ledum palustre		
a856f647d072ec638d1ddda7122bef6b	Ledum palustre var. groenlandicum		Ledum palustre var. groenlandicum 		240	false										4052287	Ledum palustre var. groenlandicum		240	variety	Ledum palustre		
ebd22c7f869c4e1b3d6147ac63d9d41a	Leonotis nepetifolia var. africana (P. Beauv.) J.K. Morton	(P.Beauv.) J.K.Morton	Leonotis nepetifolia var. africana (P. Beauv.) J.K. Morton (P.Beauv.) J.K.Morton		240	false										6117121	Leonotis nepetifolia var. africana (P. Beauv.) J.K. Morton		240	variety	Leonotis nepetifolia		
a0d1b677ac18ea3d67faaf478d8a1864	Leontodon autumnalis var. coronops		Leontodon autumnalis var. coronops 		240	false										4052151	Leontodon autumnalis var. coronops		240	variety	Leontodon autumnalis		
1e5a529908313ff4f0c3a31e9b7b6058	Leontodon autumnalis var. taraxaci		Leontodon autumnalis var. taraxaci 		240	false										4052150	Leontodon autumnalis var. taraxaci		240	variety	Leontodon autumnalis		
41ce8c116a2b1ce1555276cbc1fdb5d5	Leontodon hispidulum var. tenuiloba	Boiss.	Leontodon hispidulum var. tenuiloba Boiss.		240	false										6119178	Leontodon hispidulum var. tenuiloba Boiss.		240	variety	Leontodon hispidulum		
17b1da37559b2519608a7d950fba2afe	Leonton autumnalis var. taraxaci		Leonton autumnalis var. taraxaci 		240	false										365757	Leonton autumnalis var. taraxaci		240	variety	Leonton autumnalis		
9dfa02f456037b38f11c3947fe442db2	Leptostachya comata var. humifusa	Not on sheet	Leptostachya comata var. humifusa Not on sheet		240	false										6173544	Leptostachya comata var. humifusa		240	variety	Leptostachya comata		
0dae470b5909931257feace0f59ddeb5	Lepturus filiformis var. strictus	Lange	Lepturus filiformis var. strictus Lange		240	false										6182548	Lepturus filiformis var. strictus Lange		240	variety	Lepturus filiformis		
d9f1f4a0a4e9bc7efedf8dc6e9a27259	Leucanthemum vulgare var. crassifolium	Lange	Leucanthemum vulgare var. crassifolium Lange		240	false										6174881	Leucanthemum vulgare var. crassifolium Lange		240	variety	Leucanthemum vulgare		
cec24607b0057a0d6bbeb442d6a35f12	Leucanthemum vulgare var. puliulae	Sennen	Leucanthemum vulgare var. puliulae Sennen		240	false										6174883	Leucanthemum vulgare var. puliulae Sennen		240	variety	Leucanthemum vulgare		
52437ebaeba13397fabf3190e7ded294	Lilaeopsis carolinensis var. minor A.W. Hill	A.W.Hill	Lilaeopsis carolinensis var. minor A.W. Hill A.W.Hill		240	false										6175444	Lilaeopsis carolinensis var. minor A.W. Hill		240	variety	Lilaeopsis carolinensis		
fc0b8fa5a8f16cc28a7973b505a2be66	Limeum aethiopicum var. fluviale (Eckl. & Zeyh.) Friedr.	(Eckl. & Zeyh.) Friedrich	Limeum aethiopicum var. fluviale (Eckl. & Zeyh.) Friedr. (Eckl. & Zeyh.) Friedrich		240	false										6114461	Limeum aethiopicum var. fluviale (Eckl. & Zeyh.) Friedr.		240	variety	Limeum aethiopicum		
c571c00da65825d5400a24ba0851a198	Limnanthemum indicum var. siamenis	Ostenf.	Limnanthemum indicum var. siamenis Ostenf.		240	false										6179031	Limnanthemum indicum var. siamenis Ostenf.		240	variety	Limnanthemum indicum		
73a739cb5904e70e3c3bd5f9074ba0d8	Limosella aquatica var. borealis		Limosella aquatica var. borealis 		240	false										4076097	Limosella aquatica var. borealis		240	variety	Limosella aquatica		
5d92d11e1e27770ad089158b8e989eaa	Limosella aquatica var. minor		Limosella aquatica var. minor 		240	false										4076096	Limosella aquatica var. minor		240	variety	Limosella aquatica		
886ec6af888f4c7de0ff5ca5580fddd4	Linaria thymifolia var. aguillonensis	Garcia Mart.	Linaria thymifolia var. aguillonensis Garcia Mart.		240	false										6180950	Linaria thymifolia var. aguillonensis Garcia Mart.		240	variety	Linaria thymifolia		
40ebc8e0cae3f4b94aa74db83198afdc	Lindernia diffusa var. diffusa	Not on sheet	Lindernia diffusa var. diffusa Not on sheet		240	false										6117030	Lindernia diffusa var. diffusa		240	variety	Lindernia diffusa		
bd0723cb9c4c2653ff4f1bfb55f0a575	Linnae borealis var. americana		Linnae borealis var. americana 		240	false										4052386	Linnae borealis var. americana		240	variety	Linnae borealis		
afa6c33cc471ff1bad843e76ed045de1	Linnaea borealis var. americana		Linnaea borealis var. americana 		240	false										367144	Linnaea borealis var. americana		240	variety	Linnaea borealis		
632a2d46a7ad27826c45f308e53dc218	Litsea glaucescens var. schaffneri	(Bartlett) C.K. Allen	Litsea glaucescens var. schaffneri (Bartlett) C.K. Allen		240	false										6123094	Litsea glaucescens var. schaffneri (Bartlett) C.K. Allen		240	variety	Litsea glaucescens		
b3eae7e3b4e95fd0aad6ac9f182e84cc	Lobelia laxiflora var. petiolata E. Wimm.	E.Wimm.	Lobelia laxiflora var. petiolata E. Wimm. E.Wimm.		240	false										6183531	Lobelia laxiflora var. petiolata E. Wimm.		240	variety	Lobelia laxiflora		
8b99762e0fe5698490d1abf85f806229	Lobelia persicifolia var. latifolia	Not on Sheet	Lobelia persicifolia var. latifolia Not on Sheet		240	false										6183533	Lobelia persicifolia var. latifolia		240	variety	Lobelia persicifolia		
08da4e73884223d0b7f5f7a6a3ddebff	Locheria hirsuta var. corymbosa	Oerst.	Locheria hirsuta var. corymbosa Oerst.		240	false										433136	Locheria hirsuta var. corymbosa Oerst.		240	variety	Locheria hirsuta		
265d2eb358945fe0c1b4d35c2f86ce28	Loranthus usuiensis var. longipilosus Engl. & Krause	Engl. & K.Krause	Loranthus usuiensis var. longipilosus Engl. & Krause Engl. & K.Krause		240	false										6183242	Loranthus usuiensis var. longipilosus Engl. & Krause		240	variety	Loranthus usuiensis		
2370f0048159e6f55e103e6280bd3cef	Lotus corniculatus var. ciliatus	Koch	Lotus corniculatus var. ciliatus Koch		240	false										6116292	Lotus corniculatus var. ciliatus Koch		240	variety	Lotus corniculatus		
f2ff545b3e192c4309a3fddba0046193	Lotus strictus var. albus	(Janka) Brand	Lotus strictus var. albus (Janka) Brand		240	false										6177496	Lotus strictus var. albus (Janka) Brand		240	variety	Lotus strictus		
c6b5142a3e953115949999fd6d049e12	Lucuma mammosa var. ovidea	Pierre	Lucuma mammosa var. ovidea Pierre		240	false										6180853	Lucuma mammosa var. ovidea Pierre		240	variety	Lucuma mammosa		
3df77939fbdbab83ef73929576f638b6	Ludwigia octovalvis var. sessiliflora	(M. Michel) Raven	Ludwigia octovalvis var. sessiliflora (M. Michel) Raven		240	false										6127618	Ludwigia octovalvis var. sessiliflora (M. Michel) Raven		240	variety	Ludwigia octovalvis		
c8358dba6baab2d28b3282602bbaadab	Lupinus albus var. albus	Not on sheet	Lupinus albus var. albus Not on sheet		240	false										6171807	Lupinus albus var. albus		240	variety	Lupinus albus		
980c736c34c92b20977fa0bdad28299e	Luzula arcuata var. confusa		Luzula arcuata var. confusa 		240	false										367367	Luzula arcuata var. confusa		240	variety	Luzula arcuata		
c8513ac5af9016f13c07d607e9ed5f35	Luzula arcuata var. procerior		Luzula arcuata var. procerior 		240	false										4088377	Luzula arcuata var. procerior		240	variety	Luzula arcuata		
8740bd7b4a8c87105b73796e3943b98a	Luzula campestris var. congesta		Luzula campestris var. congesta 		240	false										4076189	Luzula campestris var. congesta		240	variety	Luzula campestris		
fc9de9e7507d7488f4dfc469c6d2c527	Luzula confusa var. subspicata		Luzula confusa var. subspicata 		240	false										4088886	Luzula confusa var. subspicata		240	variety	Luzula confusa		
305aedc863ed9e5966f9ab3d215898b7	Luzula frigida var. contracta		Luzula frigida var. contracta 		240	false										4088370	Luzula frigida var. contracta		240	variety	Luzula frigida		
4c90d4f5ae8f246b31c8a6bf4fa334c7	Luzula hyperborea var. subspicata	Lange ined.	Luzula hyperborea var. subspicata Lange ined.		240	false										367364	Luzula hyperborea var. subspicata Lange ined.		240	variety	Luzula hyperborea		
5b90c89945c34c593a63cc9e940f7c67	Luzula multiflora subsp. frigida  var. contracta	Böcher	Luzula multiflora subsp. frigida  var. contracta Böcher		240	false										4052745	Luzula multiflora subsp. frigida  var. contracta Böcher		240	variety	Luzula multiflora subsp. frigida		
255c3fbd1bec4c3216380e9c36f00082	Luzula multiflora var. congesta		Luzula multiflora var. congesta 		240	false										4052017	Luzula multiflora var. congesta		240	variety	Luzula multiflora		
61b82964a2f4eaf07cb2dea5722ac976	Luzula nivalis var. latifolia	(Kjellm.) Sam. ex Hultén	Luzula nivalis var. latifolia (Kjellm.) Sam. ex Hultén		240	false										367372	Luzula nivalis var. latifolia (Kjellm.) Sam. ex Hultén		240	variety	Luzula nivalis		
f1f3a18ed50997cf5799b368bb0a16fd	Luzula parviflora var. fastigiata	Buchenau	Luzula parviflora var. fastigiata Buchenau		240	false										432919	Luzula parviflora var. fastigiata Buchenau		240	variety	Luzula parviflora		
2d727de72db575d0a8255dbaaff756a1	Luzula spicata var. major		Luzula spicata var. major 		240	false										4052006	Luzula spicata var. major		240	variety	Luzula spicata		
3ca91ccc3257170c88d8fc5a67174e92	Lychnis alpina var. albiflora		Lychnis alpina var. albiflora 		240	false										4097456	Lychnis alpina var. albiflora		240	variety	Lychnis alpina		
2e9cf01006b8857a4ad49e6feec125e5	Lychnis apetala var. gracilis	Not on Sheet	Lychnis apetala var. gracilis Not on Sheet		240	false										6175860	Lychnis apetala var. gracilis		240	variety	Lychnis apetala		
5b8a1a21b626f5fc4096521b76928805	Lycianthes multiflora var. extutomentosa	Bitter	Lycianthes multiflora var. extutomentosa Bitter		240	false										6128586	Lycianthes multiflora var. extutomentosa Bitter		240	variety	Lycianthes multiflora		
20a78fca5591edeec3a9b49d249e5570	Lycianthes multiflora var. plictomentosa	Bitter	Lycianthes multiflora var. plictomentosa Bitter		240	false										6128587	Lycianthes multiflora var. plictomentosa Bitter		240	variety	Lycianthes multiflora		
11f8facde4b06333ba19cbb48b14e656	Lycopodium annotinum var. acrifolium		Lycopodium annotinum var. acrifolium 		240	false										367614	Lycopodium annotinum var. acrifolium		240	variety	Lycopodium annotinum		
ca0aa482328c70f722c1aa6e05b0e6e7	Lycopodium annotinum var. aepestre		Lycopodium annotinum var. aepestre 		240	false										367615	Lycopodium annotinum var. aepestre		240	variety	Lycopodium annotinum		
fccf6f73e6ff3d1c0937fd9ccd1579a3	Lycopodium annotinum var. alpestre	Hartm.	Lycopodium annotinum var. alpestre Hartm.		240	false										6182593	Lycopodium annotinum var. alpestre Hartm.		240	variety	Lycopodium annotinum		
0bc0d1814352ee62434cfa81732be70b	Lycopodium annotinum var. alpestre		Lycopodium annotinum var. alpestre 		240	false										367610	Lycopodium annotinum var. alpestre		240	variety	Lycopodium annotinum		
f073a644146fc5891818233b8dd6a8ec	Lycopodium annotinum var. imbricalum		Lycopodium annotinum var. imbricalum 		240	false										4088281	Lycopodium annotinum var. imbricalum		240	variety	Lycopodium annotinum		
5662c767e4de8d21d97af964cb9bf6f4	Lycopodium annotinum var. pungens		Lycopodium annotinum var. pungens 		240	false										367105	Lycopodium annotinum var. pungens		240	variety	Lycopodium annotinum		
38eb0857781c9300e947e3d38bf101db	Lycopodium annotinum var. vulgare		Lycopodium annotinum var. vulgare 		240	false										367613	Lycopodium annotinum var. vulgare		240	variety	Lycopodium annotinum		
1206e636dde8b30c95d8ad46f9016492	Lycopodium clavatum var. monostachyon		Lycopodium clavatum var. monostachyon 		240	false										367620	Lycopodium clavatum var. monostachyon		240	variety	Lycopodium clavatum		
906b26e83077f05a56f677884106ac8c	Lycopodium complanatum var. pseudo-alpinum		Lycopodium complanatum var. pseudo-alpinum 		240	false										365191	Lycopodium complanatum var. pseudo-alpinum		240	variety	Lycopodium complanatum		
74eb6238588d2f9a89821debf93880b4	Lycopodium selago var. alpestre		Lycopodium selago var. alpestre 		240	false										4088284	Lycopodium selago var. alpestre		240	variety	Lycopodium selago		
4cecaedbe66f592aa9eb52f2b9e581b9	Lycopodium selago var. alpestres		Lycopodium selago var. alpestres 		240	false										4088290	Lycopodium selago var. alpestres		240	variety	Lycopodium selago		
7cda1431cfd9a2a23fb332d2b955104c	Lycopodium selago var. appressum	Desv.	Lycopodium selago var. appressum Desv.		240	false										367634	Lycopodium selago var. appressum Desv.		240	variety	Lycopodium selago		
ba51136217b76a54a77807282df8fe95	Lycopodium selago var. radet		Lycopodium selago var. radet 		240	false										367637	Lycopodium selago var. radet		240	variety	Lycopodium selago		
6245394739a5b0b56acb8803b0755d19	Macropeplus ligustrinus var. dentatus	Perkins	Macropeplus ligustrinus var. dentatus Perkins		240	false										6179032	Macropeplus ligustrinus var. dentatus Perkins		240	variety	Macropeplus ligustrinus		
