dassco:taxonID	dassco:name	dassco:author	dassco:fullname	dassco:epithet	dassco:rankid	dassco:extinct	dwc:taxonID	dwc:scientificName	dwc:scientificNameAuthorship	dwc:parentNameUsageID	dwc:parentNameUsage	dwc:acceptedNameUsageID	dwc:acceptedNameUsage	dwc:taxonomicStatus	dwc:taxonRank	sp:taxonID	sp:fullname	sp:author	sp:rankid	sp:rankname	sp:parentname	sp:taxonnr	sp:taxonnrsource
4e44be7644abf35c071856e576bcbabd	Saussurea crepidifolia var. reflexa	Freyn	Saussurea crepidifolia var. reflexa Freyn		240	false										6119382	Saussurea crepidifolia var. reflexa Freyn		240	variety	Saussurea crepidifolia		
5ba584336dfd7f351a360f3ae996d24a	Saussurea glomerata var. intermedia	Freyn	Saussurea glomerata var. intermedia Freyn		240	false										6119378	Saussurea glomerata var. intermedia Freyn		240	variety	Saussurea glomerata		
013124d66c2a167dfaa0b74436fdcc5e	Saussurea glomerata var. latifolia	Freyn	Saussurea glomerata var. latifolia Freyn		240	false										6119383	Saussurea glomerata var. latifolia Freyn		240	variety	Saussurea glomerata		
f1a3c5ea7566d8e6384ed4bdf42df078	Saussurea virescens var. compacta	Freyn	Saussurea virescens var. compacta Freyn		240	false										6175242	Saussurea virescens var. compacta Freyn		240	variety	Saussurea virescens		
ad01041c1d56be72a8ad0a53558d5ddb	Saussurea virescens var. contracta	Freyn	Saussurea virescens var. contracta Freyn		240	false										6119386	Saussurea virescens var. contracta Freyn		240	variety	Saussurea virescens		
72ebb07c3bbadb6d0911b5f34beddba3	Saxifraga aizoon var. brevifolia		Saxifraga aizoon var. brevifolia 		240	false										366449	Saxifraga aizoon var. brevifolia		240	variety	Saxifraga aizoon		
29e60b090fb387d014ae48249cf3435e	Saxifraga aizoon var. neogaea		Saxifraga aizoon var. neogaea 		240	false										366445	Saxifraga aizoon var. neogaea		240	variety	Saxifraga aizoon		
9a35b95868301629546f8b7baadb88ff	Saxifraga aizoon var. robusta		Saxifraga aizoon var. robusta 		240	false										367754	Saxifraga aizoon var. robusta		240	variety	Saxifraga aizoon		
a57553699486662c24352b1ec1eea73f	Saxifraga caespitosa var. drummondii	Engl. & Irmsch.	Saxifraga caespitosa var. drummondii Engl. & Irmsch.		240	false										6126641	Saxifraga caespitosa var. drummondii Engl. & Irmsch.		240	variety	Saxifraga caespitosa		
c250390c8d6a24c2fa5d18808d7c6747	Saxifraga caespitosa var. groenlandica		Saxifraga caespitosa var. groenlandica 		240	false										367444	Saxifraga caespitosa var. groenlandica		240	variety	Saxifraga caespitosa		
6b35d8eaa917c7b5fd49b37fe8e6fe07	Saxifraga caespitosa var. uniflora		Saxifraga caespitosa var. uniflora 		240	false										367735	Saxifraga caespitosa var. uniflora		240	variety	Saxifraga caespitosa		
52b57929d52c2b8ea558ede67d2b1c59	Saxifraga cernua var. humillis	L.	Saxifraga cernua var. humillis L.		240	false										368139	Saxifraga cernua var. humillis L.		240	variety	Saxifraga cernua		
c42a129a444e84dbc6fb6eb6f9c18492	Saxifraga cernua var. propaginea	L.	Saxifraga cernua var. propaginea L.		240	false										368144	Saxifraga cernua var. propaginea L.		240	variety	Saxifraga cernua		
8872a9275d3e3c15f9c7f97b4d42468b	Saxifraga cernua var. ramosa		Saxifraga cernua var. ramosa 		240	false										4089113	Saxifraga cernua var. ramosa		240	variety	Saxifraga cernua		
a18f93eb5a68cd7882f713ff530efd88	Saxifraga cernua var. raviosa		Saxifraga cernua var. raviosa 		240	false										368142	Saxifraga cernua var. raviosa		240	variety	Saxifraga cernua		
faab08ebe27aaffb6614dba8d5bbb8a6	Saxifraga cernua var. samosa	L.	Saxifraga cernua var. samosa L.		240	false										368135	Saxifraga cernua var. samosa L.		240	variety	Saxifraga cernua		
c1ae281d28c57f9e986f2e3ef92619c1	Saxifraga cernua var. vamosa		Saxifraga cernua var. vamosa 		240	false										368140	Saxifraga cernua var. vamosa		240	variety	Saxifraga cernua		
d1493ded869aa7ca20e19689ff41a2df	Saxifraga cordilleranum var. magellanica	Poir.	Saxifraga cordilleranum var. magellanica Poir.		240	false										6180875	Saxifraga cordilleranum var. magellanica Poir.		240	variety	Saxifraga cordilleranum		
302643ad7c5ee0e7b8ae5755795b6764	Saxifraga decipiens var. caespitosa		Saxifraga decipiens var. caespitosa 		240	false										4089139	Saxifraga decipiens var. caespitosa		240	variety	Saxifraga decipiens		
83d3d2ce85d1968900106b18d2069e83	Saxifraga decipiens var. groenlandica		Saxifraga decipiens var. groenlandica 		240	false										4089125	Saxifraga decipiens var. groenlandica		240	variety	Saxifraga decipiens		
22afdd1ab0fa4ce1bb14529cfb387b4f	Saxifraga decipiens var. gronlandica		Saxifraga decipiens var. gronlandica 		240	false										4089123	Saxifraga decipiens var. gronlandica		240	variety	Saxifraga decipiens		
78f166b359c96dee060b107e59c7bce4	Saxifraga decipiens var. hyperborea		Saxifraga decipiens var. hyperborea 		240	false										368162	Saxifraga decipiens var. hyperborea		240	variety	Saxifraga decipiens		
4e3104a3feae34df8c51f20f784678c5	Saxifraga decipiens var. petalis	Ehrh.	Saxifraga decipiens var. petalis Ehrh.		240	false										368149	Saxifraga decipiens var. petalis Ehrh.		240	variety	Saxifraga decipiens		
67357ca775f2dfe858dab4af54a27d78	Saxifraga decipiens var. sternbergii		Saxifraga decipiens var. sternbergii 		240	false										4089129	Saxifraga decipiens var. sternbergii		240	variety	Saxifraga decipiens		
5161621576c404319a17879542a1a237	Saxifraga decipiens var. triloba		Saxifraga decipiens var. triloba 		240	false										4097701	Saxifraga decipiens var. triloba		240	variety	Saxifraga decipiens		
19af11ae7ba068d77a27d27944e7c328	Saxifraga decipiens var. uniflora		Saxifraga decipiens var. uniflora 		240	false										368165	Saxifraga decipiens var. uniflora		240	variety	Saxifraga decipiens		
642cfc5d6188edf577fd1d2da425a2ee	Saxifraga globulifera var. spathulata	Batt. & Trab.	Saxifraga globulifera var. spathulata Batt. & Trab.		240	false										6115506	Saxifraga globulifera var. spathulata Batt. & Trab.		240	variety	Saxifraga globulifera		
1010a59f3aa6ca402816dc58995ae9a4	Saxifraga groenlandica var. uniflora		Saxifraga groenlandica var. uniflora 		240	false										367434	Saxifraga groenlandica var. uniflora		240	variety	Saxifraga groenlandica		
10802d0885e00da39448697a31d469d7	Saxifraga hirculus var. propinqua	L.	Saxifraga hirculus var. propinqua L.		240	false										368128	Saxifraga hirculus var. propinqua L.		240	variety	Saxifraga hirculus		
d48d7344e6d26d1fd20bacc430415681	Saxifraga nivalis var. ramosa		Saxifraga nivalis var. ramosa 		240	false										4088451	Saxifraga nivalis var. ramosa		240	variety	Saxifraga nivalis		
ba0f2c12a8d190519eebc10064041b9d	Saxifraga nivalis var. tenius		Saxifraga nivalis var. tenius 		240	false										4051876	Saxifraga nivalis var. tenius		240	variety	Saxifraga nivalis		
def3f6abd9d1beba245cfa45674a5c53	Saxifraga nivalis var. tenuior	Not on sheet	Saxifraga nivalis var. tenuior Not on sheet		240	false										6118153	Saxifraga nivalis var. tenuior		240	variety	Saxifraga nivalis		
3e6db579ced29972c454a91b615b5d21	Saxifraga nivalis var. tenuior		Saxifraga nivalis var. tenuior 		240	false										4051875	Saxifraga nivalis var. tenuior		240	variety	Saxifraga nivalis		
0a5ba81e481110ee357b46beb700c76e	Saxifraga nivalis var. tenuis		Saxifraga nivalis var. tenuis 		240	false										366464	Saxifraga nivalis var. tenuis		240	variety	Saxifraga nivalis		
76c2f55889fa68ce40fc6a7076a3cb58	Saxifraga oppositifolia var. elongata		Saxifraga oppositifolia var. elongata 		240	false										366458	Saxifraga oppositifolia var. elongata		240	variety	Saxifraga oppositifolia		
f9400bd89d04ce8183f9b8c92f0fd079	Saxifraga oppositifolia var. langskaftede		Saxifraga oppositifolia var. langskaftede 		240	false										366459	Saxifraga oppositifolia var. langskaftede		240	variety	Saxifraga oppositifolia		
68de705bfca842449da9eeb53997ebf5	Saxifraga oppositifolia var. pulvinata		Saxifraga oppositifolia var. pulvinata 		240	false										4097031	Saxifraga oppositifolia var. pulvinata		240	variety	Saxifraga oppositifolia		
26cae73f78f82fe72c5d6650ae5eef06	Saxifraga rivularis var. hyperborea		Saxifraga rivularis var. hyperborea 		240	false										4076140	Saxifraga rivularis var. hyperborea		240	variety	Saxifraga rivularis		
511781bbbf610d7fd47309cbd3cee18f	Saxifraga rivularis var. purpurascens		Saxifraga rivularis var. purpurascens 		240	false										366442	Saxifraga rivularis var. purpurascens		240	variety	Saxifraga rivularis		
1a74e6fd2472e5dce39395653571466a	Saxifraga rivularis var. tenuis		Saxifraga rivularis var. tenuis 		240	false										4051874	Saxifraga rivularis var. tenuis		240	variety	Saxifraga rivularis		
7e934e7d931da136170767a8424834e0	Saxifraga stellaris var. comosa		Saxifraga stellaris var. comosa 		240	false										4051561	Saxifraga stellaris var. comosa		240	variety	Saxifraga stellaris		
cfdaac1bb7f1b6e57f6110d6efe92ed0	Saxifraga stellaris var. laxa		Saxifraga stellaris var. laxa 		240	false										4051878	Saxifraga stellaris var. laxa		240	variety	Saxifraga stellaris		
9a1144a5016bcde0fad9b4f5d95b3988	Saxifraga stellaris var. virides		Saxifraga stellaris var. virides 		240	false										4076142	Saxifraga stellaris var. virides		240	variety	Saxifraga stellaris		
6a51a07f0fa5368bdafc7bd8c9f23351	Saxifraga stricta var. minor	Hornem.	Saxifraga stricta var. minor Hornem.		240	false										6174277	Saxifraga stricta var. minor Hornem.		240	variety	Saxifraga stricta		
3d7eee5c7a22ea2416a69af5564998a4	Scaphopetalum dewevrei var. suborophila R. Germ.	R.Germ.	Scaphopetalum dewevrei var. suborophila R. Germ. R.Germ.		240	false										6115598	Scaphopetalum dewevrei var. suborophila R. Germ.		240	variety	Scaphopetalum dewevrei		
7df7e6d49080b59f2dd4cac66ef964f2	Schinus terebinthifolia var. pohliana	Raddi	Schinus terebinthifolia var. pohliana Raddi		240	false										6117796	Schinus terebinthifolia var. pohliana Raddi		240	variety	Schinus terebinthifolia		
6ead08ce5b23a6ebb9afd9c40ee3a9e2	Schwannia elegans var. rotundifolia	Griseb.	Schwannia elegans var. rotundifolia Griseb.		240	false										6182916	Schwannia elegans var. rotundifolia Griseb.		240	variety	Schwannia elegans		
a8dd1bb4bed40817ed4031d06cc5366c	Schwannia muricata var. typica	Nied.	Schwannia muricata var. typica Nied.		240	false										6178614	Schwannia muricata var. typica Nied.		240	variety	Schwannia muricata		
9f519496c6b9ae08c4e66d7716f3339d	Scirpus acicularis var. submersa		Scirpus acicularis var. submersa 		240	false										4097398	Scirpus acicularis var. submersa		240	variety	Scirpus acicularis		
b2fd9c4d44fa30ede86ff4bc77a18734	Scirpus caespitosus var. austiacus		Scirpus caespitosus var. austiacus 		240	false										4097660	Scirpus caespitosus var. austiacus		240	variety	Scirpus caespitosus		
3fcf281fa58daa89e72125448896a1eb	Scirpus caespitosus var. australis		Scirpus caespitosus var. australis 		240	false										4089092	Scirpus caespitosus var. australis		240	variety	Scirpus caespitosus		
20b1124b31492c1ec5bea4d884f61bb7	Scirpus caespitosus var. austriacus	L.	Scirpus caespitosus var. austriacus L.		240	false										368088	Scirpus caespitosus var. austriacus L.		240	variety	Scirpus caespitosus		
558ea709f3e4f2dd8d465b2ddc3ae13b	Scirpus caespitosus var. callosus		Scirpus caespitosus var. callosus 		240	false										367315	Scirpus caespitosus var. callosus		240	variety	Scirpus caespitosus		
ac30b4865e987723b57e02d3f540e9d7	Scirpus lateralis var. elatior	Not on Sheet	Scirpus lateralis var. elatior Not on Sheet		240	false										6176802	Scirpus lateralis var. elatior		240	variety	Scirpus lateralis		
df541c4972eb43234d20829a38417b04	Scirpus maritimus var. monostachys	Lange	Scirpus maritimus var. monostachys Lange		240	false										6182491	Scirpus maritimus var. monostachys Lange		240	variety	Scirpus maritimus		
fe7620d541ddd75c7cee6058eea67baa	Scleria reticularia var. anceps	(Liebm.) Fairy	Scleria reticularia var. anceps (Liebm.) Fairy		240	false										6121135	Scleria reticularia var. anceps (Liebm.) Fairy		240	variety	Scleria reticularia		
477ecfa7b93c9e822d5b0bf6ae9b1270	Scrophularia auriculata var. minor	Lange	Scrophularia auriculata var. minor Lange		240	false										6126834	Scrophularia auriculata var. minor Lange		240	variety	Scrophularia auriculata		
46d36d3371286e70236303939e36912f	Scutellaria dependens var. minor	Freyn	Scutellaria dependens var. minor Freyn		240	false										6122847	Scutellaria dependens var. minor Freyn		240	variety	Scutellaria dependens		
53cecf9dd4e3ba8b67fef492b9c943ce	Sebastiania corniculata var. incarna	Müll. Arg.	Sebastiania corniculata var. incarna Müll. Arg.		240	false										6177212	Sebastiania corniculata var. incarna Müll.Arg.		240	variety	Sebastiania corniculata		
8f4f3b03b6a50936c1afe73ac3f93b3d	Sebastiania ditassoides var. glabrata Müll. Arg.	(Müll.Arg.) Müll.Arg.	Sebastiania ditassoides var. glabrata Müll. Arg. (Müll.Arg.) Müll.Arg.		240	false										6177196	Sebastiania ditassoides var. glabrata Müll.Arg.		240	variety	Sebastiania ditassoides		
0d597885ba185df8ae6e0762c1651683	Sebastiania ditassoides var. parvifolia Müll. Arg.	(Müll.Arg.) Müll.Arg.	Sebastiania ditassoides var. parvifolia Müll. Arg. (Müll.Arg.) Müll.Arg.		240	false										6177202	Sebastiania ditassoides var. parvifolia Müll.Arg.		240	variety	Sebastiania ditassoides		
2b653cce4f36258a119007993bff1548	Sebastiania glandulosa var. transiens	Müll. Arg.	Sebastiania glandulosa var. transiens Müll. Arg.		240	false										6177205	Sebastiania glandulosa var. transiens Müll.Arg.		240	variety	Sebastiania glandulosa		
7f6c7f69fb608dc7d34bbacbcabd0f08	Sedum quadrifidum var. scoparia	Hook. f. & Thomson	Sedum quadrifidum var. scoparia Hook. f. & Thomson		240	false										6176202	Sedum quadrifidum var. scoparia Hook.f. & Thomson		240	variety	Sedum quadrifidum		
ef8320bcd1e1a8e71fde685e71aafdbe	Selinum tianschanicum var. transitorium	Korovin	Selinum tianschanicum var. transitorium Korovin		240	false										6119792	Selinum tianschanicum var. transitorium Korovin		240	variety	Selinum tianschanicum		
16b689f39c506add03cefc3343929b90	Senecio aegyptius var. discoideus	Boiss.	Senecio aegyptius var. discoideus Boiss.		240	false										6116570	Senecio aegyptius var. discoideus Boiss.		240	variety	Senecio aegyptius		
c86ad2fb1cc45d8fea11a6422a289101	Senecio aquaticus var. erraticus	(Bertol.) Matthews	Senecio aquaticus var. erraticus (Bertol.) Matthews		240	false										6116572	Senecio aquaticus var. erraticus (Bertol.) Matthews		240	variety	Senecio aquaticus		
1191f2bff958cd44f1fb72cb97f1c5df	Senecio coronopifolius var. sphacelatus	O. Hoffm.	Senecio coronopifolius var. sphacelatus O. Hoffm.		240	false										6175224	Senecio coronopifolius var. sphacelatus O.Hoffm.		240	variety	Senecio coronopifolius		
0b07df3a37f4e8b5ee00ef6fceaad7fb	Senecio multidentatus var. minor	Hemsl.	Senecio multidentatus var. minor Hemsl.		240	false										6175225	Senecio multidentatus var. minor Hemsl.		240	variety	Senecio multidentatus		
19a678172baea54c02256ba279d063ed	Senna hirsuta var. acuminata (Benth.) H.S. Irwin & Barneby	(Benth.) H.S.Irwin & Barneby	Senna hirsuta var. acuminata (Benth.) H.S. Irwin & Barneby (Benth.) H.S.Irwin & Barneby		240	false										6122273	Senna hirsuta var. acuminata (Benth.) H.S. Irwin & Barneby		240	variety	Senna hirsuta		
deb8397fbc34b068bdf7c2b9539e1481	Sesbania sesban var. bicolor	(Wight & Arn.) F.W. Andrews	Sesbania sesban var. bicolor (Wight & Arn.) F.W. Andrews		240	false										6183101	Sesbania sesban var. bicolor (Wight & Arn.) F.W. Andrews		240	variety	Sesbania sesban		
960e93607d167a0182df21bd28cad6ff	Sicyos laciniatus var. genuina	Cogn.	Sicyos laciniatus var. genuina Cogn.		240	false										6120752	Sicyos laciniatus var. genuina Cogn.		240	variety	Sicyos laciniatus		
07292e0980ce9f5991a82f58c5c6f260	Silene acaulis var. alba		Silene acaulis var. alba 		240	false										4076039	Silene acaulis var. alba		240	variety	Silene acaulis		
9ebe9a5beaefe0d816a8fdf0dd4e96c7	Silene caucasica var. pamirensis	H. Winkl.	Silene caucasica var. pamirensis H. Winkl.		240	false										6175869	Silene caucasica var. pamirensis H. Winkl.		240	variety	Silene caucasica		
e491b0fc0f9ca657dffdb59ff1e0c5fa	Silene gonosperma var. himalayense	(Rohrb.) Bocquet	Silene gonosperma var. himalayense (Rohrb.) Bocquet		240	false										6120221	Silene gonosperma var. himalayense (Rohrb.) Bocquet		240	variety	Silene gonosperma		
273bbe1594f587da3af94c5e7a9bcf20	Silene involucrata var. affinis		Silene involucrata var. affinis 		240	false										367876	Silene involucrata var. affinis		240	variety	Silene involucrata		
a2ec50c5b6e4f764e5623dcb819ecd79	Silene involucrata var. involucrata		Silene involucrata var. involucrata 		240	false										367901	Silene involucrata var. involucrata		240	variety	Silene involucrata		
17bbf36ffcf87e95abb269ab318d6f1f	Silene involucrata var. uffinis		Silene involucrata var. uffinis 		240	false										367166	Silene involucrata var. uffinis		240	variety	Silene involucrata		
1514306aff1ad9ce8f6ed3cceb8a6639	Silene linearis var. tenella	Fenzl	Silene linearis var. tenella Fenzl		240	false										6175839	Silene linearis var. tenella Fenzl		240	variety	Silene linearis		
a3d228b01fc36739d4426883c54deb00	Silene sorensenis var. involucrata	(Cham. & Schltdl.) Bocquet	Silene sorensenis var. involucrata (Cham. & Schltdl.) Bocquet		240	false										4075685	Silene sorensenis var. involucrata (Cham. & Schltdl.) Bocquet		240	variety	Silene sorensenis		
225b9627d907c6a0351666355ca192b6	Simsia annectens var. grayi	(Sch. Bip. ex S.F. Blake) D.M. Spooner	Simsia annectens var. grayi (Sch. Bip. ex S.F. Blake) D.M. Spooner		240	false										6119389	Simsia annectens var. grayi (Sch. Bip. ex S.F. Blake) D.M. Spooner		240	variety	Simsia annectens		
1a934193c827f3f56289b0b303d17ef6	Simsia foetida var. grandiflora (Benth.) D.M. Spooner	(Benth.) D.M.Spooner	Simsia foetida var. grandiflora (Benth.) D.M. Spooner (Benth.) D.M.Spooner		240	false										6119391	Simsia foetida var. grandiflora (Benth.) D.M. Spooner		240	variety	Simsia foetida		
896ed1efda915f03b1a8a34e192f1f58	Siparuna thecaphora var. domatiata	(A.H. Gentry) Renner & Hausner	Siparuna thecaphora var. domatiata (A.H. Gentry) Renner & Hausner		240	false										6124252	Siparuna thecaphora var. domatiata (A.H. Gentry) Renner & Hausner		240	variety	Siparuna thecaphora		
6642899ae200a204f343132dc138820e	Siphocampylus grandidentatus var. incisus	E. Wimm.	Siphocampylus grandidentatus var. incisus E. Wimm.		240	false										6175745	Siphocampylus grandidentatus var. incisus E. Wimm.		240	variety	Siphocampylus grandidentatus		
b33d08638586e36c72e44625948b43cf	Siphoneugena chnoosepala var. regnelliana	Not on Sheet	Siphoneugena chnoosepala var. regnelliana Not on Sheet		240	false										6179404	Siphoneugena chnoosepala var. regnelliana		240	variety	Siphoneugena chnoosepala		
8123edb397cfd3abda89b251d32756de	Sisyrinchium scabrum var. exaltatum	Not on sheet	Sisyrinchium scabrum var. exaltatum Not on sheet		240	false										6177850	Sisyrinchium scabrum var. exaltatum		240	variety	Sisyrinchium scabrum		
54cdf9640e3190162a00224c76ef2a74	Smilax china var. recticaulis T. Koyama	T.Koyama	Smilax china var. recticaulis T. Koyama T.Koyama		240	false										6126878	Smilax china var. recticaulis T. Koyama		240	variety	Smilax china		
1e729889ca964d8bc86793cd3e34279c	Solanum fraxinofolium var. protoxanthum	(Bitter) Bitter	Solanum fraxinofolium var. protoxanthum (Bitter) Bitter		240	false										6126956	Solanum fraxinofolium var. protoxanthum (Bitter) Bitter		240	variety	Solanum fraxinofolium		
fc8c8ed7b601ab6d63806ab1df376b45	Solanum gilo var. gilo	Not on Sheet	Solanum gilo var. gilo Not on Sheet		240	false										6117210	Solanum gilo var. gilo		240	variety	Solanum gilo		
4176b4b98a23405cc3666ca05fa34fa1	Solanum igneum var. parviflorum	Vahl	Solanum igneum var. parviflorum Vahl		240	false										6181074	Solanum igneum var. parviflorum Vahl		240	variety	Solanum igneum		
6517f10d8892096c23a4b8445aace5e6	Solanum mannii var. compactum	Wright	Solanum mannii var. compactum Wright		240	false										6115546	Solanum mannii var. compactum Wright		240	variety	Solanum mannii		
5bdeaa3b85b75f84701916a76f5656ff	Solanum nigrum var. villosum	Not on sheet	Solanum nigrum var. villosum Not on sheet		240	false										6178275	Solanum nigrum var. villosum		240	variety	Solanum nigrum		
2d2bf073c0793189194ed8943dd19667	Solanum persicifolium var. belloi O.E. Schulz	O.E.Schulz	Solanum persicifolium var. belloi O.E. Schulz O.E.Schulz		240	false										6181077	Solanum persicifolium var. belloi O.E. Schulz		240	variety	Solanum persicifolium		
552718a37ac9f592d997df59fd3ce88e	Solanum persicifolium var. belloi	Schulz	Solanum persicifolium var. belloi Schulz		240	false										6181079	Solanum persicifolium var. belloi Schulz		240	variety	Solanum persicifolium		
cf5a73beffa634fd9086b1c3efc71e6a	Solanum persicifolium var. parvifolium	(Vahl) O.E. Schulz	Solanum persicifolium var. parvifolium (Vahl) O.E. Schulz		240	false										6181076	Solanum persicifolium var. parvifolium (Vahl) O.E. Schulz		240	variety	Solanum persicifolium		
1b51de1550ac796722d4d33693242c76	Solanum ramosum var. angustifolium	Not on sheet	Solanum ramosum var. angustifolium Not on sheet		240	false										6181081	Solanum ramosum var. angustifolium		240	variety	Solanum ramosum		
a34d32e0f99cb48514f8d684f1a054dd	Solanum stagnale var. nolitangere	(Salzm. ex Dun.) Bitter	Solanum stagnale var. nolitangere (Salzm. ex Dun.) Bitter		240	false										6127006	Solanum stagnale var. nolitangere (Salzm. ex Dun.) Bitter		240	variety	Solanum stagnale		
5a2387e032ec6de61edd90b1740f569f	Solanum umbrosum var. inermis	Not on Sheet	Solanum umbrosum var. inermis Not on Sheet		240	false										6173219	Solanum umbrosum var. inermis		240	variety	Solanum umbrosum		
7f0cf8a2d54b085c4539a572580e141c	Solidago virga-aurea var. macrorrhiza	Not on Sheet	Solidago virga-aurea var. macrorrhiza Not on Sheet		240	false										6119397	Solidago virga-aurea var. macrorrhiza		240	variety	Solidago virga-aurea		
40cabe536fa8ee49acdc28be8b3874c5	Sorbus decora var. groenlandica		Sorbus decora var. groenlandica 		240	false										367745	Sorbus decora var. groenlandica		240	variety	Sorbus decora		
9f9da288e9781875ed2edb76a7bd6072	Sorbus decora var. groenlandicum		Sorbus decora var. groenlandicum 		240	false										365609	Sorbus decora var. groenlandicum		240	variety	Sorbus decora		
8ffef92c2544b6785379d2b78887843d	Sorghum dochna var. obovatum	(Hack.) J.D. Snowden	Sorghum dochna var. obovatum (Hack.) J.D. Snowden		240	false										6171656	Sorghum dochna var. obovatum (Hack.) J.D. Snowden		240	variety	Sorghum dochna		
7375d76e7b7f730a8b313eba55bbad24	Sorghum durra var. fecundum	J.D. Snowden	Sorghum durra var. fecundum J.D. Snowden		240	false										6171665	Sorghum durra var. fecundum J.D. Snowden		240	variety	Sorghum durra		
1eca7b9df0511ae83d960bb30ddd50e4	Sorghum papyrascens var. erhenbergianum	(Koern.) J.D. Snowden	Sorghum papyrascens var. erhenbergianum (Koern.) J.D. Snowden		240	false										6171653	Sorghum papyrascens var. erhenbergianum (Koern.) J.D. Snowden		240	variety	Sorghum papyrascens		
a90c06611eae8eb1156ad07a31065bc3	Sparattosperma lithontripticum var. subtomentosum	Bureau	Sparattosperma lithontripticum var. subtomentosum Bureau		240	false										6183676	Sparattosperma lithontripticum var. subtomentosum Bureau		240	variety	Sparattosperma lithontripticum		
bdc1b024789cee5432d2530b8ff8fcd0	Spergula arvensis var. sativa	(Boenn.) Mert. & W.D.J.Koch	Spergula arvensis var. sativa (Boenn.) Mert. & W.D.J.Koch		240	false										432486	Spergula arvensis var. sativa (Boenn.) Mert. & W.D.J.Koch		240	variety	Spergula arvensis		
20caf3aa083ace46b96427b09a60c3ca	Spiraea argentea var. mexicana	(Regel) Kuntze	Spiraea argentea var. mexicana (Regel) Kuntze		240	false										6183499	Spiraea argentea var. mexicana (Regel) Kuntze		240	variety	Spiraea argentea		
1ff645568c089def06e556312dafa800	Spiraea argentea var. mexicanus	(Regel) Kuntze	Spiraea argentea var. mexicanus (Regel) Kuntze		240	false										6183500	Spiraea argentea var. mexicanus (Regel) Kuntze		240	variety	Spiraea argentea		
b8b6d95e6dbe0c80eaa144f1662f4380	Spiranthes bonariensis var. bombylifera Rchb. f. & Warm.	Rchb.f. & Warm.	Spiranthes bonariensis var. bombylifera Rchb. f. & Warm. Rchb.f. & Warm.		240	false										6183295	Spiranthes bonariensis var. bombylifera Rchb.f. & Warm.		240	variety	Spiranthes bonariensis		
3fa26b0f9d0e9322a115bfe4840dc7b4	Stachys viscosa var. kotschyi	Benth.	Stachys viscosa var. kotschyi Benth.		240	false										6178113	Stachys viscosa var. kotschyi Benth.		240	variety	Stachys viscosa		
a5b6a9d97341cd2bf4e7a078be39c2ce	Statice armeria var. sibirica		Statice armeria var. sibirica 		240	false										4097445	Statice armeria var. sibirica		240	variety	Statice armeria		
d6329c295ea260e289bcb29ac7496327	Statice graeca var. hyssopifolia	Boiss.	Statice graeca var. hyssopifolia Boiss.		240	false										6179800	Statice graeca var. hyssopifolia Boiss.		240	variety	Statice graeca		
5fc473fb91444a490ab0f595a00c1cca	Statice labradorica var. submutica		Statice labradorica var. submutica 		240	false										4051675	Statice labradorica var. submutica		240	variety	Statice labradorica		
303d3c22989e9774e9ca8f14d71c4464	Statice minuta var. acutifolia	Boiss.?	Statice minuta var. acutifolia Boiss.?		240	false										6170852	Statice minuta var. acutifolia Boiss.?		240	variety	Statice minuta		
6f77d55126d74aa4847d62780bf7f8f6	Statice psiloclada var. albida	Boiss.	Statice psiloclada var. albida Boiss.		240	false										6179796	Statice psiloclada var. albida Boiss.		240	variety	Statice psiloclada		
f36f9ea6fa9c0b3320f6c38575d51c8c	Statice psiloclada var. intermedia	Boiss.	Statice psiloclada var. intermedia Boiss.		240	false										6179802	Statice psiloclada var. intermedia Boiss.		240	variety	Statice psiloclada		
